문제,정답,해설
"후단 경합범이란 금고 이상의 형에 처한 판결이 확정된 죄와 그 판결확정 전에 범한 죄를 가리키는데, 여기서 말하는 판결에는 집행유예 판결도 포함된다.",O,형법 제37조 후단의 경합범에 있어서 판결이 확정된 죄라 함은 수개의 독립한 죄중의 어느죄에 대하여 확정판결이 있었던 경우를 의미하며 여기에서의 확정판결에는 집행유예의 판결과 선고유예의 판결도 포함되고 집행유예의 선고나 형의 선고유예를 받은 후 그 유예기간이 경과하여 형의 선고가 실효되었거나 면소된 것으로 간주되었다 하더라도 마찬가지라고 할 것이다(92도1417).
확정판결이 있는 죄에 대하여 일반사면이 있는 경우는 형의 선고효력이 상실되지만 그 죄에 대한 확정판결이 있었던 사실 자체는 인정되므로 그 확정판결 이전에 범한 죄와의 관계에서 후단 경합범이 성립한다.,O,"사면법 제5조 제1항 제1호 소정의 '일반사면은 형의 언도의 효력이 상실된다.'는 의미는 형법 제65조 소정의 '형의 선고는 효력을 잃는다.'는 의미와 마찬가지로 단지 형의 선고의 법률적 효과가 없어진다는 것일 뿐 형의 선고가 있었다는 기왕의 사실 자체의 모든 효과까지 소멸한다는 뜻은 아니다(당원 1983. 4. 2.자 83모8 결정 참조).
 따라서 확정판결의 죄에 대하여 일반사면이 있다 하더라도 일사부재리의 효력 등은 여전히 계속 존속하는 것이고, 확정판결이 있었던 사실에 의하여 그 전의 죄와 후의 죄 등이 형법 제37조 후단의 경합범관계에 있었다고 하는 효과도 일반사면에 의하여 좌우되는 것은 아니라 할 것이다(95도2446)."
포괄일죄로 되는 개개의 범죄행위가 다른 종류의 죄의 확정판결 전후에 걸쳐서 행하여진 경우에는 그 죄는 2죄로 분리되지 않고 확정판결 후인 최종의 범죄행위시에 완성되므로 후단 경합범에 해당하지 않는다.,O,"사기죄에 있어서 동일한 피해자에 대하여 수회에 걸쳐 기망행위를 하여 금원을 편취한 경우, 그 범의가 단일하고 범행 방법이 동일하다면 사기죄의 포괄일죄만이 성립한다 할 것이고, 포괄일죄는 그 중간에 별종의 범죄에 대한 확정판결이 끼어 있어도 그 때문에 포괄적 범죄가 둘로 나뉘는 것은 아니라 할 것이고, 또 이 경우에는 그 확정판결 후의 범죄로서 다루어야 한다(2002도2029)."
"판결을 받지 아니한 수개의 죄가 판결확정을 전후하여 저질러진 경우 판결확정 전에 범한 죄를 이미 판결이 확정된 죄와 동시에 판결할 수 없었던 경우라면, 판결확정을 전후한 각각의 범죄는 ｢형법｣ 제37조 후단 경합범이 아니라 전단 경합범에 해당하여 하나의 형을 선고하여야 한다.",X,"형법 제37조 후단 및 제39조 제1항의 문언, 입법 취지 등에 비추어 보면, 아직 판결을 받지 아니한 죄가 이미 판결이 확정된 죄와 동시에 판결할 수 없었던 경우에는 형법 제37조 후단의 경합범 관계가 성립할 수 없고 형법 제39조 제1항에 따라 동시에 판결할 경우와 형평을 고려하여 형을 선고하거나 그 형을 감경 또는 면제할 수도 없다고 해석함이 상당하다(대법원 2011. 10. 27. 선고 2009도9948 판결, 대법원 2012. 9. 27. 선고 2012도9295 판결 등 참조). 한편 아직 판결을 받지 아니한 수개의 죄가 판결 확정을 전후하여 저질러진 경우 판결 확정 전에 범한 죄를 이미 판결이 확정된 죄와 동시에 판결할 수 없었던 경우라고 하여 마치 확정된 판결이 존재하지 않는 것처럼 그 수개의 죄 사이에 형법 제37조 전단의 경합범 관계가 인정되어 형법 제38조가 적용된다고 볼 수도 없으므로, 판결 확정을 전후한 각각의 범죄에 대하여 별도로 형을 정하여 선고할 수밖에 없다(대법원 2011. 6. 10. 선고 2011도2351 판결 참조).
 원심판결 이유 및 기록에 의하면, 이 사건 2012. 1. 5.자 및 2012. 1. 17.자 마약류 관리에 관한 법률 위반(향정)죄는 피고인이 서울중앙지방법원에서 같은 죄로 징역 8월에 집행유예 2년을 선고받은 판결이 2012. 2. 29. 확정되기 전에 범한 것이기는 하나, 피고인에게는 위 전과와 별도로 서울중앙지방법원에서 같은 죄 등으로 징역 1년에 집행유예 2년을 선고받아 2011. 11. 26. 판결이 확정된 전과가 있고, 2012. 2. 29. 판결이 확정된 죄는 위 2011. 11. 26. 판결 확정 전에 범한 것이어서 2012. 2. 29. 판결이 확정된 죄와 이 사건 2012. 1. 5.자 및 2012. 1. 17.자 범죄는 처음부터 동시에 판결할 수 없었음을 알 수 있다.
 따라서 2012. 2. 29. 판결이 확정된 죄와 이 사건 2012. 1. 5.자 및 2012. 1. 17.자 범죄 사이에 형법 제37조 후단의 경합범 관계가 성립할 수 없고, 경합범 중 판결을 받지 아니한 죄에 대하여 형을 선고할 때는 그 죄와 판결이 확정된 죄를 동시에 판결할 경우와 형평을 고려하도록 한 형법 제39조 제1항은 여기에 적용될 여지가 없다고 할 것이다. 그렇다고 하여 마치 2012. 2. 29. 확정된 판결이 존재하지 않는 것처럼 이 사건 범죄 중 위 판결 확정 전에 범한 2012. 1. 5.자 및 2012. 1. 17.자 범죄와 위 판결 확정 후에 범한 나머지 범죄 사이에 형법 제37조 전단의 경합범 관계가 인정되어 형법 제38조가 적용된다고 볼 수도 없다. 따라서 이 사건 범죄 중 2012. 1. 5.자 및 2012. 1. 17.자 범죄와 나머지 범죄에 대하여 별도로 형을 정하여 선고할 수밖에 없다(2014도469)."
후단 경합범에 대하여 ｢형법｣ 제39조 제1항에 의하여 형을 감경할 때에도 법률상 감경에 관한 ｢형법｣ 제55조 제1항이 적용되어 유기징역을 감경할 때에는 그 형기의 2분의 1 미만으로는 감경할 수 없다.,O,2017도14609.
"사채업자 A의 채무변제 독촉을 받고 있던 甲은 아들 B(20세)의 상해보험금을 타서 이를 변제하기로 하고 B의 진지한 승낙을 받아 B의 새끼손가락을 절단한 경우, 甲의 상해행위는 위법성이 조각되지 않는다.",O,
"甲은 乙과 말다툼을 하다가 낫을 들고 반항하는 乙로부터 낫을 빼앗아 乙의 가슴, 배, 목 등을 10여 차례 찔러 乙로 하여금 자상으로 사망하게 한 경우, 甲의 행위는 그 정도를 초과한 것으로서 ｢형법｣ 제21조 제2항의 과잉방위에 해당한다.",X,"형법 제21조 소정의 정당방위가 성립하려면 침해행위에 의하여 침해되는 법익의 종류, 정도, 침해의 방법, 침해행위의 완급과 방위행위에 의하여 침해될 법익의 종류, 정도 등 일체의 구체적 사정들을 참작하여 방위행위가 사회적으로 상당한 것이어야 한다(대법원 1992. 12. 22. 선고 92도2540 판결, 2005. 9. 30. 선고 2005도3940, 2005감도15 판결 등 참조).
 원심은 그 채택 증거에 의하여 판시와 같은 사실을 인정한 다음, 피해자가 피고인에게 한 가해의 수단 및 정도, 그에 비교되는 피고인의 행위의 수단, 방법과 행위의 결과 등 제반 사정에 비추어, 피고인의 이 사건 범행행위가 피해자의 피고인에 대한 현재의 부당한 침해를 방위하거나 그러한 침해를 예방하기 위한 행위로 상당한 이유가 있는 경우에 해당한다고 볼 수 없고, 또 피고인의 이 사건 범행행위는 방위행위가 그 정도를 초과한 때에 해당하거나 정도를 초과한 방위행위가 야간 기타 불안스러운 상태하에서 공포, 경악, 흥분 또는 당황으로 인한 때에 해당한다고 볼 수도 없다고 판단하였는바, 앞서 본 법리와 기록에 비추어 살펴보면, 위와 같은 원심의 조치는 옳은 것으로 수긍이 가고, 거기에 상고이유의 주장과 같은 채증법칙 위배로 인한 사실오인이나 정당방위 및 과잉방위에 관한 법리오해의 위법이 있다고 할 수 없다(2007도1794)."
"甲이 스스로 야기한 강간범행의 와중에 피해자 A가 甲의 손가락을 깨물며 반항하자 물린 손가락을 비틀어 잡아 뽑다가 A에게 치아결손의 상해를 입힌 경우, 甲의 행위는 법에 의하여 용인되는 피난행위라 할 수 없다.",O,
"甲이 乙로부터 갑자기 뺨을 맞는 등 폭행을 당하여 서로 멱살을 잡고 다투자 주위 사람들이 싸움을 제지하였으나 甲은 맨손으로 공격하는 乙에게 대항하기 위하여 깨어진 병으로 乙을 찌를 듯이 겨누어 협박한 경우, 甲의 행위는 사회통념상 그 정도를 초과하여 상당성이 결여된 것으로서 정당방위에 해당하지 않는다.",O,"피고인이 피해자로부터 갑작스럽게 뺨을 맞는 등 폭행을 당하여 서로 멱살을 잡고 다투자 주위 사람들이 싸움을 제지하였으나 피해자에게 대항하기 위하여 깨어진 병으로 피해자를 찌를 듯이 겨누어 협박한 경우, 피고인의 행위는 자기의 법익에 대한 현재의 부당한 침해를 방어하기 위한 것이라고 볼 수 있으나, 맨손으로 공격하는 상대방에 대하여 위험한 물건인 깨어진 병을 가지고 대항한다는 것은 사회통념상 그 정도를 초과한 방어행위로서 상당성이 결여된 것이고, 또 주위사람들이 싸움을 제지하였다는 상황에 비추어 야간의 공포나 당황으로 인한 것이었다고 보기도 어렵다(91도80)."
"甲이 불심검문을 받아 경찰관 A에게 운전면허증을 교부한 후 불심검문에 항의하는 과정에서 우발적으로 큰소리로 욕설을 하여 A뿐만 아니라 인근 주민도 그 욕설을 직접 들었던 상황에서, A가 甲을 모욕죄의 현행범으로 체포하려 하자 甲이 이에 반항하는 과정에서 A에게 상해를 입힌 행위는 정당방위에 해당하지 않는다.",X,"피고인이 경찰관의 불심검문을 받아 운전면허증을 교부한 후 경찰관에게 큰 소리로 욕설을 하였는데, 경찰관이 모욕죄의 현행범으로 체포하겠다고 고지한 후 피고인의 오른쪽 어깨를 붙잡자 반항하면서 경찰관에게 상해를 가한 사안에서, 피고인은 경찰관의 불심검문에 응하여 이미 운전면허증을 교부한 상태이고, 경찰관뿐 아니라 인근 주민도 욕설을 직접 들었으므로, 피고인이 도망하거나 증거를 인멸할 염려가 있다고 보기는 어렵고, 피고인의 모욕 범행은 불심검문에 항의하는 과정에서 저지른 일시적, 우발적인 행위로서 사안 자체가 경미할 뿐 아니라, 피해자인 경찰관이 범행현장에서 즉시 범인을 체포할 급박한 사정이 있다고 보기도 어려우므로, 경찰관이 피고인을 체포한 행위는 적법한 공무집행이라고 볼 수 없고, 피고인이 체포를 면하려고 반항하는 과정에서 상해를 가한 것은 불법체포로 인한 신체에 대한 현재의 부당한 침해에서 벗어나기 위한 행위로서 정당방위에 해당한다는 이유로, 피고인에 대한 상해 및 공무집행방해의 공소사실을 무죄로 인정한 원심판단을 수긍한 사례(2011도3682)."
경합범의 처벌에 관한 ｢형법｣ 제38조 제1항 제3호에 의하여 징역형과 벌금형을 병과하는 경우에 징역형에만 작량감경을 하고 벌금형에는 작량감경을 하지 않는 것은 위법하다.,X,형법 제38조 제1항 제3호에 의하여 징역형과 벌금형을 병과하는 경우에는 각 형에 대한 범죄의 정상에 차이가 있을 수 있으므로 징역형에만 작량감경을 하고 벌금형에는 작량감경을 하지 아니하였다고 하여 이를 위법하다고 할 수 없다(2006도1076).
"2020. 7. 1. 무고죄로 징역 1년에 집행유예 2년을 선고받고 그 판결이 같은 달 9. 확정된 甲이 2021. 6. 1. 상습도박죄를 범하여 같은 해 11. 1. 유죄판결을 선고받는 경우, 법원은 甲에게 상습도박죄에 대한 집행유예는 선고할 수 없다.",O,"집행유예 기간 중에 범한 죄에 대하여 형을 선고할 때에, 집행유예의 결격사유를 정하는 형법 제62조 제1항 단서 소정의 요건에 해당하는 경우란, 이미 집행유예가 실효 또는 취소된 경우와 그 선고 시점에 미처 유예기간이 경과하지 아니하여 형 선고의 효력이 실효되지 아니한 채로 남아 있는 경우로 국한되고, 집행유예가 실효 또는 취소됨이 없이 유예기간을 경과한 때에는, 형의 선고가 이미 그 효력을 잃게 되어 ‘금고 이상의 형을 선고’한 경우에 해당한다고 보기 어려울 뿐 아니라, 집행의 가능성이 더 이상 존재하지 아니하여 집행종료나 집행면제의 개념도 상정하기 어려우므로 위 단서 소정의 요건에 해당하지 않는다고 할 것이므로, 집행유예 기간 중에 범한 범죄라고 할지라도 집행유예가 실효 취소됨이 없이 그 유예기간이 경과한 경우에는 이에 대해 다시 집행유예의 선고가 가능하다(2006도6196)."
몰수에 관한 ｢형법｣ 제48조 제1항의 ‘범인’에는 공범자도 포함되므로 피고인의 소유물은 물론 공범자의 소유물도 그 공범자의 소추 여부를 불문하고 몰수할 수 있다.,O,2006도5586.
사기도박에 참여하도록 유인하기 위하여 고액의 수표를 제시해 보인 경우라도 그 수표가 직접적으로 도박자금으로 사용되지 않았다면 몰수할 수 없다.,X,"피해자로 하여금 사기도박에 참여하도록 유인하기 위하여 고액의 수표를 제시해 보인 경우, 형법 제48조 소정의 몰수가 임의적 몰수에 불과하여 법관의 자유재량에 맡겨져 있고, 위 수표가 직접적으로 도박자금으로 사용되지 아니하였다 할지라도, 위 수표가 피해자로 하여금 사기도박에 참여하도록 만들기 위한 수단으로 사용된 이상, 이를 몰수할 수 있고, 그렇다고 하여 피고인에게 극히 가혹한 결과가 된다고 볼 수는 없다고 한 사례(2002도3589)."
강도상해의 범행에 대하여 자수한 사안에서 법원이 자수감경을 하지 않았거나 자수감경 주장에 대한 판단을 하지 않았다고 해도 위법하다고 할 수 없다.,O,피고인이 자수하였다 하더라도 자수한 이에 대하여는 법원이 임의로 형을 감경할 수 있음에 불과한 것으로서 원심이 자수감경을 하지 아니하였다거나 자수감경 주장에 대하여 판단을 하지 아니하였다 하여 위법하다고 할 수 없다(2011도12041).
특수강간이 미수에 그쳤다 하더라도 그로 인하여 피해자가 상해를 입었다면 ｢성폭력범죄의 처벌 등에 관한 특례법｣에 의한 특수강간치상죄의 기수가 성립한다.,O,
강도가 재물강취의 뜻을 재물의 부재로 이루지 못한 채 미수에 그쳤으나 그 자리에서 항거불능의 상태에 빠진 피해자를 간음할 것을 결의하고 실행에 착수했으나 역시 미수에 그쳤더라도 반항을 억압하기 위한 폭행으로 피해자에게 상해를 입힌 경우에는 강도강간미수죄와 강도치상죄의 실체적 경합범이 성립한다.,X,강도강간미수죄와 강도치상죄가 성립되고 이는 1개의 행위가 2개의 죄명에 해당되어 상상적 경합관계가 성립된다(88도820).
"재물을 강취한 후 피해자를 살해할 목적으로 현주건조물에 방화하여 사망에 이르게 한 경우, 강도살인죄와 현주건조물방화치사죄에 해당하고 그 두 죄는 상상적 경합관계에 있다.",O,"형법 제338조(강도살인ㆍ치사) 강도가 사람을 살해한 때에는 ""사형 또는 무기징역""에 처한다. (후략)
 제164조(현주건조물 등 방화) ① 불을 놓아 사람이 주거로 사용하거나 사람이 현존하는 건조물, 기차, 전차, 자동차, 선박, 항공기 또는 지하채굴시설을 불태운 자는 무기 또는 3년 이상의 징역에 처한다.
 ② 제1항의 죄를 지어 사람을 상해에 이르게 한 경우에는 무기 또는 5년 이상의 징역에 처한다. 사망에 이르게 한 경우에는 ""사형, 무기 또는 7년 이상의 징역""에 처한다."
"수뢰후부정처사죄는 반드시 뇌물수수 등의 행위가 완료된 이후에 부정한 행위가 이루어져야 함을 의미하는 것은 아니고, 결합범 또는 결과적가중범 등에서의 기본행위와 마찬가지로 뇌물수수 등의 행위를 하는 중에 부정한 행위를 한 경우도 포함한다.",O,"수뢰후부정처사죄를 정한 형법 제131조 제1항은 공무원 또는 중재인이 형법 제129조(수뢰, 사전수뢰) 및 제130조(제3자뇌물제공)의 죄를 범하여 부정한 행위를 하는 것을 구성요건으로 하고 있다. 여기에서 ‘형법 제129조 및 제130조의 죄를 범하여’란 반드시 뇌물수수 등의 행위가 완료된 이후에 부정한 행위가 이루어져야 함을 의미하는 것은 아니고, 결합범 또는 결과적 가중범 등에서의 기본행위와 마찬가지로 뇌물수수 등의 행위를 하는 중에 부정한 행위를 한 경우도 포함하는 것으로 보아야 한다. 따라서 단일하고도 계속된 범의 아래 일정 기간 반복하여 일련의 뇌물수수 행위와 부정한 행위가 행하여졌고 그 뇌물수수 행위와 부정한 행위 사이에 인과관계가 인정되며 피해법익도 동일하다면, 최후의 부정한 행위 이후에 저질러진 뇌물수수 행위도 최후의 부정한 행위 이전의 뇌물수수 행위 및 부정한 행위와 함께 수뢰후부정처사죄의 포괄일죄로 처벌함이 타당하다(2020도12103)."
무고죄의 구성요건요소인 ‘형사처분 또는 징계처분을 받게 할 목적’은 미필적 인식으로 족하고 결과발생을 희망하는 것까지 요하는 것은 아니다.,O,
"상해의 고의로 행한 구타행위로 상해를 입은 피해자가 정신을 잃고 빈사상태에 빠지자 사망한 것으로 오인하고, 자신의 행위를 은폐하고 피해자가 자살한 것처럼 가장하기 위해 피해자를 호텔 베란다 밖으로 떨어뜨려 사망하게 하였다면, 상해죄와 과실치사죄의 경합범이 된다.",X,상해치사죄에 해당한다.
"주치의 甲은 경력 7년의 책임간호사 乙에게 종전 처방과 같이 환자 A에게 별다른 부작용이 없었던 소염제･항생제 등을 대퇴부 정맥에 연결된 튜브를 통하여 투여할 것을 지시하였는데 甲의 예견과는 달리 乙이 간호실습생 丙에게 단독으로 정맥주사를 하게 하였고 丙이 대퇴부 정맥튜브와 뇌실외배액관을 착오하여 뇌실외배액관에 주사액을 주입함으로써 A가 사망한 경우, 甲에게 현장에 입회하여 乙의 주사행위를 감독할 업무상 주의의무가 있다고 볼 수 없다.",O,"간호사가 '진료의 보조'를 함에 있어서는 모든 행위 하나하나마다 항상 의사가 현장에 입회하여 일일이 지도·감독하여야 한다고 할 수는 없고, 경우에 따라서는 의사가 진료의 보조행위 현장에 입회할 필요 없이 일반적인 지도·감독을 하는 것으로 족한 경우도 있을 수 있다 할 것인데, 여기에 해당하는 보조행위인지 여부는 보조행위의 유형에 따라 일률적으로 결정할 수는 없고 구체적인 경우에 있어서 그 행위의 객관적인 특성상 위험이 따르거나 부작용 혹은 후유증이 있을 수 있는지, 당시의 환자 상태가 어떠한지, 간호사의 자질과 숙련도는 어느 정도인지 등의 여러 사정을 참작하여 개별적으로 결정하여야 한다.
 간호사가 의사의 처방에 의한 정맥주사(Side Injection 방식)를 의사의 입회 없이 간호실습생(간호학과 대학생)에게 실시하도록 하여 발생한 의료사고에 대한 의사의 과실을 부정한 사례(2001도3667)."
"甲이 A, B, C 등 3명과 싸우다가 힘이 달리자 갑자기 인근 가게에서 식칼을 가지고 와 상해의 고의로 이들 3명을 상대로 휘두르다가 빗나가 옆에 있던 D에게 상해를 입혔다면 甲에게 D의 상해에 대한 고의가 인정된다.",O,
살인의 실행행위가 피해자의 사망이라는 결과를 발생하게 한 유일한 원인이거나 직접적인 원인이어야만 되는 것은 아니므로 통상 예견할 수 있는 다른 사실이 개재되어 그 사실이 사망의 직접적인 원인이 되었다고 하더라도 실행행위와 피해자의 사망 사이에 인과관계는 인정된다.,O,
정신적 장애가 있는 자라고 하여도 범행 당시 정상적인 사물변별능력이나 행위통제능력이 있었다면 심신장애자로 볼 수 없다.,O,
심신상실을 이유로 처벌받지 아니하거나 심신미약을 이유로 형벌이 감경될 수 있는 자라 할지라도 금고 이상의 형에 해당하는 죄를 지은 자에 대해서는 치료감호시설에서 치료를 받을 필요가 있고 재범의 위험성이 있는 경우 치료감호의 대상이 된다.,O,"치료감호 등에 관한 법률 제2조(치료감호대상자) ① 이 법에서 “치료감호대상자”란 다음 각 호의 어느 하나에 해당하는 자로서 치료감호시설에서 치료를 받을 필요가 있고 재범의 위험성이 있는 자를 말한다.
 1. 「형법」 제10조제1항에 따라 벌하지 아니하거나 같은 조 제2항에 따라 형을 감경할 수 있는 심신장애인으로서 금고 이상의 형에 해당하는 죄를 지은 자"
｢소년법｣ 제60조 제2항은 ‘소년의 특성에 비추어 상당하다고 인정되는 때에는 그 형을 감경할 수 있다’고 규정하고 있는데 여기에서의 ‘소년’에 해당하는지 여부의 판단은 원칙적으로 범죄행위시가 아니라 사실심 판결선고시를 기준으로 한다.,O,"소년법 제60조 제2항에서는 소년이라 함은 특별한 정함이 없는 한 소년법 제2조에서 말하는 소년을 의미한다고 할 것인데, 소년법 제2조에서의 소년이라 함은 [19]세미만자로서, [19]세미만 자라는 것이 심판의 조건이므로 범행시뿐만 아니라 심판시까지 계속되어야 한다고 보아야 하며, 이는 소년법 제38조 제1항의 규정에 비추어 보아도 명백할 뿐만 아니라, 소년법은 원심이 거시한 바와 같은 소년의 특성 때문에 현재 소년이라는 상태를 중시하여 소년의 건전한 육성을 기하려는 것이고 소년법 제60조 제2항도 이러한 취지에서 나왔다고 볼 것이지, 원심과 같이 소년법 제60조 제2항이 형법 제9조와 같이 연령을 책임요소로 파악한 데서 나왔다거나 위와 같은 소년의 특성을 책임의 문제로서 파악하여야만 하는 것은 아니라 할 것이므로, 소년법 제60조 제2항의 소년인지 여부의 판단은 원칙으로 심판시 즉 사실심 판결선고시를 기준으로 한다고 보아야 한다(91도2393)."
원인에 있어서 자유로운 행위의 가벌성 근거와 관련하여 예외모델은 원인설정행위를 실행행위라고 이해하므로 실행행위의 정형성에 반한다는 비판을 받는다.,X,구성요건모델에 대한 설명이다.
｢형법｣ 제12조의 강요된 행위에서 ‘저항할 수 없는 폭력’이란 심리적 의미에 있어서 육체적으로 어떤 행위를 절대적으로 하지 아니할 수 없게 하는 경우와 윤리적 의미에 있어서 강압된 경우를 말한다.,O,
"甲이 A회사의 전문건설업등록증 등의 이미지 파일을 위조하여 공사 수주에 사용하기 위해 발주업체 직원 B에게 이메일로 송부하여 위조 사실을 모르는 B로 하여금 위 이미지 파일을 출력하게 한 경우, 간접정범을 통한 위조문서행사 범행의 피이용자인 B는 甲과 동일시할 수 있는 자와 마찬가지이므로 甲에게는 위조문서행사죄의 간접정범이 성립하지 아니한다.",X,"위조문서행사죄에 있어서 행사는 위조된 문서를 진정한 것으로 사용함으로써 문서에 대한 공공의 신용을 해칠 우려가 있는 행위를 말하므로 그 행사의 상대방에는 아무런 제한이 없고, 다만 문서가 위조된 것임을 이미 알고 있는 공범자 등에게 행사하는 경우에는 위조문서행사죄가 성립할 수 없으나(대법원 2005. 1. 28. 선고 2004도4663 판결 참조), 간접정범을 통한 위조문서행사범행에 있어 도구로 이용된 자라고 하더라고 문서가 위조된 것임을 알지 못하는 자에게 행사한 경우에는 위조문서행사죄가 성립한다(2011도14441)."
甲이 A에 대한 사기범행을 실현하는 수단으로서 B를 기망하여 B를 A로부터 편취한 재물이나 재산상 이익을 전달하는 도구로서만 이용한 경우에는 편취의 대상인 재물 또는 재산상 이익에 관하여 A에 대한 사기죄가 성립할 뿐 도구로 이용된 B에 대한 사기죄가 별도로 성립하는 것은 아니다.,O,
