문제,정답,해설
"검사가 당초 ‘피고인이 A 등에게 필로폰 약 0.3g을 교부하였다’고 하여 마약류관리에관한법률위반(향정)으로 공소를 제기하였다가 ‘피고인이 A 등에게 필로폰을 구해주겠다고 속여 A 등에게서 필로폰 대금을 편취하였다’는 사기 범죄사실을 예비적으로 추가하는 공소장변경을 신청한 경우, 위 두 범죄사실은 기본적인 사실관계가 동일하므로 공소장변경은 허용된다.",X,"당초의 공소사실인 마약류관리에 관한 법률 위반(향정)의 범죄사실과 검사의 공소장변경에 의해 예비적으로 추가된 사기의 범죄사실은 그 수단·방법 등 범죄사실의 내용이나 행위의 태양 및 피해법익이 다르고 죄질에도 현저한 차이가 있어, 그 기본적인 사실관계가 동일하다고 볼 수 없다.
 그렇다면 이러한 공소장변경허가신청은 공소사실의 동일성 범위 내의 것이라고 할 수 없음에도 불구하고 원심은 공소장변경을 허가한 후 공소장변경으로 추가된 예비적 범죄사실에 대하여 유죄로 판단하였으니, 이러한 원심판결에는 공소사실의 동일성 내지 공소장변경에 관한 법리를 오해한 위법이 있고, 이를 지적하는 상고이유는 이유 있다(2010도16659)."
"공소장변경절차에 의하여 공소사실이 변경됨에 따라 그 법정형에 차이가 있는 경우에는 변경된 공소사실에 대한 법정형이 공소시효기간의 기준이 되고, 그 공소시효의 완성 여부도 공소장 변경시를 기준으로 한다.",X,공소시효의 완성 여부는 당초의 공소제기가 있었던 시점을 기준으로 한다.
"<甲은 2021. 1. 20.부터 영업허가를 받지 아니하고 음식점 영업행위를 하였다. 이에 ㉠ [검사는 2021. 6. 21. 甲에 대해 ‘2021. 1. 20.부터 2021. 5. 31.까지’의 식품위생법위반죄로 공소제기하였다.] 그럼에도 甲은 계속해서 무허가 영업을 하였고, 이로 인해 이웃 乙과 다툼이 잦았다. 어느 날 ㉡ [乙은 도박으로 돈을 잃고 밤에 귀가하던 중 甲의 음식점 문을 뜯고 들어가 보관함에 있던 현금을 가지고 나왔다.] 다음날 甲이 간밤에 도둑이 들었다면서 乙을 의심하며 큰소리로 다툼을 하자, ㉢ [뛰쳐나온 이웃주민 A, B가 있는 자리에서 乙은 “甲은 징역 살다온 전과자다.”라고 수회 소리를 쳤다.]>
 ㉠의 기소로 제1심 공판절차 진행 중 甲이 2021. 3. 20.부터 2021. 5. 20.까지의 동일한 식품위생법위반죄로 2021. 6. 3. 벌금 100만 원의 약식명령을 발령받아 그 무렵 확정되었음이 밝혀졌다면, 법원은 甲에게 공소기각의 판결을 선고해야 한다.",X,면소의 판결을 해야 한다.
"<甲은 2021. 1. 20.부터 영업허가를 받지 아니하고 음식점 영업행위를 하였다. 이에 ㉠ [검사는 2021. 6. 21. 甲에 대해 ‘2021. 1. 20.부터 2021. 5. 31.까지’의 식품위생법위반죄로 공소제기하였다.] 그럼에도 甲은 계속해서 무허가 영업을 하였고, 이로 인해 이웃 乙과 다툼이 잦았다. 어느 날 ㉡ [乙은 도박으로 돈을 잃고 밤에 귀가하던 중 甲의 음식점 문을 뜯고 들어가 보관함에 있던 현금을 가지고 나왔다.] 다음날 甲이 간밤에 도둑이 들었다면서 乙을 의심하며 큰소리로 다툼을 하자, ㉢ [뛰쳐나온 이웃주민 A, B가 있는 자리에서 乙은 “甲은 징역 살다온 전과자다.”라고 수회 소리를 쳤다.]>
 ㉠의 기소로 제1심 공판절차 진행 중 甲이 2021. 3. 20.부터 2021. 5. 20.까지의 동일한 식품위생법위반죄로 2021. 6. 3. 벌금 100만 원의 약식명령을 발령받아 그 무렵 확정되었음이 밝혀지자 검사는 범행일자를 ‘2021. 6. 4.부터 2021. 10. 20.까지’로 변경하는 내용의 공소장변경허가신청을 하였다면, 법원은 이를 허가하여야 한다.",X,"포괄일죄인 영업범에서 공소제기의 효력은 공소가 제기된 범죄사실과 동일성이 인정되는 범죄사실의 전체에 미치므로, 공판심리 중에 그 범죄사실과 동일성이 인정되는 범죄사실이 추가로 발견된 경우에 검사는 공소장변경절차에 의하여 그 범죄사실을 공소사실로 추가할 수 있다. 그러나 공소제기된 범죄사실과 추가로 발견된 범죄사실 사이에 그 범죄사실들과 동일성이 인정되는 또 다른 범죄사실에 대한 유죄의 확정판결이 있는 때에는, 추가로 발견된 확정판결 후의 범죄사실은 공소제기된 범죄사실과 분단되어 동일성이 없는 별개의 범죄가 된다. 따라서 이때 검사는 공소장변경절차에 의하여 확정판결 후의 범죄사실을 공소사실로 추가할 수는 없고 별개의 독립된 범죄로 공소를 제기하여야 한다(2016도21342)."
"<甲은 2021. 1. 20.부터 영업허가를 받지 아니하고 음식점 영업행위를 하였다. 이에 ㉠ [검사는 2021. 6. 21. 甲에 대해 ‘2021. 1. 20.부터 2021. 5. 31.까지’의 식품위생법위반죄로 공소제기하였다.] 그럼에도 甲은 계속해서 무허가 영업을 하였고, 이로 인해 이웃 乙과 다툼이 잦았다. 어느 날 ㉡ [乙은 도박으로 돈을 잃고 밤에 귀가하던 중 甲의 음식점 문을 뜯고 들어가 보관함에 있던 현금을 가지고 나왔다.] 다음날 甲이 간밤에 도둑이 들었다면서 乙을 의심하며 큰소리로 다툼을 하자, ㉢ [뛰쳐나온 이웃주민 A, B가 있는 자리에서 乙은 “甲은 징역 살다온 전과자다.”라고 수회 소리를 쳤다.]>
 검사가 ㉡의 범죄사실로 기소한 경우, 도박죄의 법정형은 1천만 원 이하의 벌금이고, 특수절도죄의 법정형은 1년 이상 10년 이하의 징역이므로, 법원은 징역형과 벌금형을 병과하여 형을 선고하여야 한다.",O,
"<甲은 2021. 1. 20.부터 영업허가를 받지 아니하고 음식점 영업행위를 하였다. 이에 ㉠ [검사는 2021. 6. 21. 甲에 대해 ‘2021. 1. 20.부터 2021. 5. 31.까지’의 식품위생법위반죄로 공소제기하였다.] 그럼에도 甲은 계속해서 무허가 영업을 하였고, 이로 인해 이웃 乙과 다툼이 잦았다. 어느 날 ㉡ [乙은 도박으로 돈을 잃고 밤에 귀가하던 중 甲의 음식점 문을 뜯고 들어가 보관함에 있던 현금을 가지고 나왔다.] 다음날 甲이 간밤에 도둑이 들었다면서 乙을 의심하며 큰소리로 다툼을 하자, ㉢ [뛰쳐나온 이웃주민 A, B가 있는 자리에서 乙은 “甲은 징역 살다온 전과자다.”라고 수회 소리를 쳤다.]>
 ㉡과 관련하여, 乙의 특수절도죄가 ｢형법｣의 누범에 해당한다면, 특수절도에 대해서는 법정형의 단기와 장기 모두 2배를 가중한 범위 내에서 선고형을 정하여야 한다.",X,"형법 제35조(누범) ② 누범의 형은 그 죄에 대하여 정한 형의 ""장기(長期)""의 2배까지 가중한다."
"<甲은 2021. 1. 20.부터 영업허가를 받지 아니하고 음식점 영업행위를 하였다. 이에 ㉠ [검사는 2021. 6. 21. 甲에 대해 ‘2021. 1. 20.부터 2021. 5. 31.까지’의 식품위생법위반죄로 공소제기하였다.] 그럼에도 甲은 계속해서 무허가 영업을 하였고, 이로 인해 이웃 乙과 다툼이 잦았다. 어느 날 ㉡ [乙은 도박으로 돈을 잃고 밤에 귀가하던 중 甲의 음식점 문을 뜯고 들어가 보관함에 있던 현금을 가지고 나왔다.] 다음날 甲이 간밤에 도둑이 들었다면서 乙을 의심하며 큰소리로 다툼을 하자, ㉢ [뛰쳐나온 이웃주민 A, B가 있는 자리에서 乙은 “甲은 징역 살다온 전과자다.”라고 수회 소리를 쳤다.]>
 ㉢과 관련하여, 명예훼손죄 판단에 있어서 乙 발언의 전파가능성에 대한 증명은 검사의 자유로운 증명으로 충분하다.",X,"공연성은 명예훼손죄의 구성요건으로서, 특정 소수에 대한 사실적시의 경우 공연성이 부정되는 유력한 사정이 있다고 볼 수 있으므로, 전파가능성에 관해서는 검사의 엄격한 증명이 필요하다(2015도12933)."
"<甲은 식당을 운영하는 乙과 乙의 건물 증축공사에 필요한 형틀공사 계약을 체결한 후 그 공사를 완료하였는데, 乙이 공사대금을 주지 않자 건물 입구에 쌓아두었던 건축 자재를 일부러 치우지 않았고 이로 인해 乙은 추가 공사를 진행할 수 없었다. 이후 증축공사를 전부 완료하였으나 乙은 영업이 제대로 이루어지지 않아 건물을 담보로 X은행에서 3억 원의 대출을 받고, 채권최고액 3억 6천만 원의 근저당권을 설정해주었다. 그럼에도 영업이 나아질 기미가 없자 A에게 건물을 5억 원에 매각하기로 약정하고 계약금과 중도금을 받았다. 이후 乙 건물 인근에 도로확충개발 소문이 돌자 B가 시가 상당액인 7억 원에 건물을 매입하겠다고 하여, 乙은 B에게 매매대금을 받고 소유권이전등기를 해주었다. 한편 乙이 농수산물의원산지표시등에관한법률위반으로 단속에 걸리자 이 소식을 들은 부동산업자 丙이 “담당공무원을 잘 알고 있으니, 나에게 현금으로 500만 원만 주면 잘 해결해주겠다.”라고 하여 乙은 丙에게 500만 원을 이체해주었다.>
 甲이 건축자재를 일부러 치우지 않은 행위는 乙의 증축공사 업무에 대하여 하는 적극적인 방해행위와 동등한 형법적 가치를 가진다고 볼 수 없으므로 부작위에 의한 업무방해죄가 성립하지 아니한다.",O,
"<甲은 식당을 운영하는 乙과 乙의 건물 증축공사에 필요한 형틀공사 계약을 체결한 후 그 공사를 완료하였는데, 乙이 공사대금을 주지 않자 건물 입구에 쌓아두었던 건축 자재를 일부러 치우지 않았고 이로 인해 乙은 추가 공사를 진행할 수 없었다. 이후 증축공사를 전부 완료하였으나 乙은 영업이 제대로 이루어지지 않아 건물을 담보로 X은행에서 3억 원의 대출을 받고, 채권최고액 3억 6천만 원의 근저당권을 설정해주었다. 그럼에도 영업이 나아질 기미가 없자 A에게 건물을 5억 원에 매각하기로 약정하고 계약금과 중도금을 받았다. 이후 乙 건물 인근에 도로확충개발 소문이 돌자 B가 시가 상당액인 7억 원에 건물을 매입하겠다고 하여, 乙은 B에게 매매대금을 받고 소유권이전등기를 해주었다. 한편 乙이 농수산물의원산지표시등에관한법률위반으로 단속에 걸리자 이 소식을 들은 부동산업자 丙이 “담당공무원을 잘 알고 있으니, 나에게 현금으로 500만 원만 주면 잘 해결해주겠다.”라고 하여 乙은 丙에게 500만 원을 이체해주었다.>
 乙에게는 A에 대한 특정경제범죄가중처벌등에관한법률위반(배임)죄가 성립한다.",X,
"<甲은 식당을 운영하는 乙과 乙의 건물 증축공사에 필요한 형틀공사 계약을 체결한 후 그 공사를 완료하였는데, 乙이 공사대금을 주지 않자 건물 입구에 쌓아두었던 건축 자재를 일부러 치우지 않았고 이로 인해 乙은 추가 공사를 진행할 수 없었다. 이후 증축공사를 전부 완료하였으나 乙은 영업이 제대로 이루어지지 않아 건물을 담보로 X은행에서 3억 원의 대출을 받고, 채권최고액 3억 6천만 원의 근저당권을 설정해주었다. 그럼에도 영업이 나아질 기미가 없자 A에게 건물을 5억 원에 매각하기로 약정하고 계약금과 중도금을 받았다. 이후 乙 건물 인근에 도로확충개발 소문이 돌자 B가 시가 상당액인 7억 원에 건물을 매입하겠다고 하여, 乙은 B에게 매매대금을 받고 소유권이전등기를 해주었다. 한편 乙이 농수산물의원산지표시등에관한법률위반으로 단속에 걸리자 이 소식을 들은 부동산업자 丙이 “담당공무원을 잘 알고 있으니, 나에게 현금으로 500만 원만 주면 잘 해결해주겠다.”라고 하여 乙은 丙에게 500만 원을 이체해주었다.>
 乙에게는 특정범죄가중처벌등에관한법률위반(알선증재)죄가, 丙에게는 특정범죄가중처벌등에관한법률위반(알선수재)죄가 성립한다.",X,"특정범죄 가중처벌 등에 관한 법률 제3조(알선수재) 공무원의 직무에 속한 사항의 알선에 관하여 금품이나 이익을 수수ㆍ요구 또는 약속한 사람은 5년 이하의 징역 또는 1천만원 이하의 벌금에 처한다.
 위 법에 알선증재를 처벌하는 규정은 없다."
"<甲은 식당을 운영하는 乙과 乙의 건물 증축공사에 필요한 형틀공사 계약을 체결한 후 그 공사를 완료하였는데, 乙이 공사대금을 주지 않자 건물 입구에 쌓아두었던 건축 자재를 일부러 치우지 않았고 이로 인해 乙은 추가 공사를 진행할 수 없었다. 이후 증축공사를 전부 완료하였으나 乙은 영업이 제대로 이루어지지 않아 건물을 담보로 X은행에서 3억 원의 대출을 받고, 채권최고액 3억 6천만 원의 근저당권을 설정해주었다. 그럼에도 영업이 나아질 기미가 없자 A에게 건물을 5억 원에 매각하기로 약정하고 계약금과 중도금을 받았다. 이후 乙 건물 인근에 도로확충개발 소문이 돌자 B가 시가 상당액인 7억 원에 건물을 매입하겠다고 하여, 乙은 B에게 매매대금을 받고 소유권이전등기를 해주었다. 한편 乙이 농수산물의원산지표시등에관한법률위반으로 단속에 걸리자 이 소식을 들은 부동산업자 丙이 “담당공무원을 잘 알고 있으니, 나에게 현금으로 500만 원만 주면 잘 해결해주겠다.”라고 하여 乙은 丙에게 500만 원을 이체해주었다.>
 검사가 乙의 이중매매에 대해 丙이 관여하였다고 보아 丙을 공동정범으로 기소하였으나 법원이 丙에게 방조의 죄책이 인정된다고 판단하여 공소장변경없이 방조범을 인정하는 경우, 심리과정에서 방조범에 대해 전혀 언급이 없거나 공방이 이뤄지지 않았다 하더라도 이는 丙의 방어권행사에 실질적인 불이익을 초래한 것이 아니므로 위법하지 아니하다.",X,"형법상 방조행위는 정범이 범행을 한다는 정을 알면서 그 실행행위를 용이하게 하는 직접·간접의 행위를 말하므로, 방조범은 정범의 실행을 방조한다는 이른바 방조의 고의와 정범의 행위가 구성요건에 해당하는 행위라는 점에 대한 인식, 즉 정범의 고의가 있어야 한다. 이러한 방조범은 공동정범과 비교할 때 형법상 다 같이 공범의 형식으로 규정되어 있다고 하더라도 그 성립요건에서 엄연한 차이가 있고 범의의 내용도 반드시 동일하지 않다. 따라서 공동정범으로 기소된 피고인이 정범으로서의 공동가공 의사나 실행행위의 분담이 없었다고 다투는 것과 범행을 주도하는 정범의 존재를 전제로 하여 그 정범의 실행행위를 인식하면서 단순히 이를 돕는 행위를 한다는 방조의 의사 및 방조행위의 내용을 다투는 것은 방어권 행사의 내용과 접근방식에서 크게 다를 수 있다.
 한편 형사소송법은 공소사실의 동일성 범위 내에서 공소장을 변경할 수 있도록 하는 한편 법원에 대해서도 심리의 경과에 비추어 상당하다고 인정할 때에는 검사에게 공소장의 변경을 요구하여야 한다고 규정하고 있다(형사소송법 제298조 제2항). 비록 위 공소장 변경 요구가 법원의 의무라고 할 것은 아니라고 하더라도, 법원이 당초의 공소사실과 다른 사실을 심판대상으로 삼아 유죄로 인정하고자 할 경우에는 공소장변경 절차를 거치는 것이 불고불리 원칙 등 형사소송의 기본원칙에 부합한다 할 것이다. 다만 공판과정에서 이미 변경하여 인정하려는 사실이 심판대상으로 드러나 공방이 되었다거나 당초의 공소사실에 대한 심판범위에 변경하여 인정하려는 사실이 포섭되어 있다는 등 특별한 사정이 있어 피고인의 방어권 행사를 해치지 아니할 정도라고 인정되는 경우라면 예외적으로 공소장 변경 없이도 직권에 의하여 공소사실과 동일성이 인정되는 범위 내에서 그와 다른 사실을 인정하여 유죄로 판단하는 것이 허용된다고 할 것이다. 이러한 취지에서 공소사실의 동일성이 인정되는 범위 내에서 공소가 제기된 범죄사실보다 가벼운 범죄사실이 인정되는 경우 법원이 공소장변경 없이 직권으로 그 범죄사실을 인정할 수는 있으나, 그 경우에도 심리의 경과 등에 비추어 이로 인하여 피고인의 방어에 실질적인 불이익을 주는 것이 아니어야 한다.
 이와 같은 형법상 방조행위 및 형사소송법상 공소장변경에 관한 법리에 비추어 볼 때, 공동정범으로 공소가 제기된 피고인에 대하여 법원이 공소장 변경 없이 직권으로 방조범으로 인정하여 처벌하기 위해서는, 정범의 범행에 대한 공동가공의 의사나 기능적 행위지배의 점에 대한 증명이 부족하지만 그 의심이 있다는 정도로는 부족하고 방조의 고의와 행위가 있었다는 점에 대한 적극적인 증명이 있어야 하고, 나아가 그 점에 대하여 피고인에게 방어의 기회가 제공되는 등 심리의 경과에 비추어 피고인의 방어에 실질적인 불이익을 주지 아니한 경우라야 가능할 것이다(2009도7166)."
"<사법경찰관 P1은 甲이 지하철역 에스컬레이터에서 휴대전화 카메라를 이용하여 A의 치마 속을 몰래 촬영하는 것을 발견하고 甲을 현행범인으로 체포하면서 甲의 휴대전화를 압수하였고, 사건을 인계받은 사법경찰관 P2는 甲을 피의자로 신문한 후 석방하였다. 이후 甲은 음주 후 승용차를 운전하던 중 음주단속을 피하기 위하여 도망가다가 운전 중인 승용차로 단속 중이던 사법경찰관 P3을 고의로 들이받아 전치 6주의 상해를 입혔다. 검사는 甲을 위 범죄사실로 기소하였다.>
 P1의 현행범인 체포절차가 적법하지 않은 경우, 체포를 면하려고 저항하는 과정에서 甲이 P1을 폭행하더라도 이는 정당방위로서 공무집행방해죄가 성립하지 않는다.",X,구성요건이 조각된다.
"<사법경찰관 P1은 甲이 지하철역 에스컬레이터에서 휴대전화 카메라를 이용하여 A의 치마 속을 몰래 촬영하는 것을 발견하고 甲을 현행범인으로 체포하면서 甲의 휴대전화를 압수하였고, 사건을 인계받은 사법경찰관 P2는 甲을 피의자로 신문한 후 석방하였다. 이후 甲은 음주 후 승용차를 운전하던 중 음주단속을 피하기 위하여 도망가다가 운전 중인 승용차로 단속 중이던 사법경찰관 P3을 고의로 들이받아 전치 6주의 상해를 입혔다. 검사는 甲을 위 범죄사실로 기소하였다.>
 P1이 甲의 휴대전화를 적법하게 압수하면서 작성한 압수조서의 ‘압수경위’란에 ‘甲이 지하철역 에스컬레이터에서 짧은 치마를 입고 올라가는 여성을 쫓아가 뒤에 밀착하여 치마 속으로 휴대전화를 집어넣는 등 해당 여성의 신체를 몰래 촬영하는 행동을 하였다’는 내용이 기재되어 있고, 그 하단에 甲의 범행을 직접 목격하고 위 압수조서를 작성한 P1의 기명날인이 있는 경우, 위 압수조서의 ‘압수경위’란에 기재된 내용은 ｢형사소송법｣ 제312조 제5항의 ‘피고인이 아닌 자가 수사과정에서 작성한 진술서’에 준하는 것으로 볼 수 있다.",O,2019도13290.
"<사법경찰관 P1은 甲이 지하철역 에스컬레이터에서 휴대전화 카메라를 이용하여 A의 치마 속을 몰래 촬영하는 것을 발견하고 甲을 현행범인으로 체포하면서 甲의 휴대전화를 압수하였고, 사건을 인계받은 사법경찰관 P2는 甲을 피의자로 신문한 후 석방하였다. 이후 甲은 음주 후 승용차를 운전하던 중 음주단속을 피하기 위하여 도망가다가 운전 중인 승용차로 단속 중이던 사법경찰관 P3을 고의로 들이받아 전치 6주의 상해를 입혔다. 검사는 甲을 위 범죄사실로 기소하였다.>
 만약 위 휴대전화에 대한 압수가 위법한 경우, P1이 작성한 압수조서 중 ‘압수경위’란에 기재된 내용은 위법하게 수집된 증거에 터잡아 획득한 2차적 증거로서 피고인이 증거로 함에 동의하더라도 원칙적으로 증거능력이 없다.",X,"위 압수조서 중 ‘압수경위’란에 기재된 내용은 피고인이 범행을 저지르는 현장을 직접 목격한 사람의 진술이 담긴 것으로서 형사소송법 제312조 제5항에서 정한 ‘피고인이 아닌 자가 수사과정에서 작성한 진술서’에 준하는 것으로 볼 수 있고, 이에 따라 휴대전화기에 대한 임의제출절차가 적법하였는지에 영향을 받지 않는 별개의 독립적인 증거에 해당하여, 피고인이 증거로 함에 동의한 이상 유죄를 인정하기 위한 증거로 사용할 수 있을 뿐 아니라 피고인의 자백을 보강하는 증거가 된다고 볼 여지가 많다는 이유로, 이와 달리 피고인의 자백을 뒷받침할 보강증거가 없다고 보아 무죄를 선고한 원심판결에 자백의 보강증거 등에 관한 법리를 오해하거나 필요한 심리를 다하지 아니한 잘못이 있다고 한 사례(2019도13290)."
"<사법경찰관 P1은 甲이 지하철역 에스컬레이터에서 휴대전화 카메라를 이용하여 A의 치마 속을 몰래 촬영하는 것을 발견하고 甲을 현행범인으로 체포하면서 甲의 휴대전화를 압수하였고, 사건을 인계받은 사법경찰관 P2는 甲을 피의자로 신문한 후 석방하였다. 이후 甲은 음주 후 승용차를 운전하던 중 음주단속을 피하기 위하여 도망가다가 운전 중인 승용차로 단속 중이던 사법경찰관 P3을 고의로 들이받아 전치 6주의 상해를 입혔다. 검사는 甲을 위 범죄사실로 기소하였다.>
 P2는 조사과정의 영상녹화를 위해 미리 영상녹화사실을 甲과 A에게 각각 알려주었으나 甲은 촬영을 거부하고 A는 이에 동의한 경우, 甲에 대한 영상녹화물은 기억환기를 위한 자료로 활용할 수 없지만, A에 대한 영상녹화물은 참고인 진술조서의 실질적 진정성립을 증명하기 위한 방법으로 사용할 수 있다.",X,"甲은 촬영을 거부한 경우에도 甲에 대한 영상녹화물을 기억환기를 위한 자료로 활용할 수 있다.
 형사소송법 제221조(제3자의 출석요구 등) ①검사 또는 사법경찰관은 수사에 필요한 때에는 피의자가 아닌 자의 출석을 요구하여 진술을 들을 수 있다. 이 경우 그의 동의를 받아 영상녹화할 수 있다.
 제244조의2(피의자진술의 영상녹화) ①피의자의 진술은 영상녹화할 수 있다. 이 경우 미리 영상녹화사실을 알려주어야 하며, 조사의 개시부터 종료까지의 전 과정 및 객관적 정황을 영상녹화하여야 한다.
 제312조(검사 또는 사법경찰관의 조서 등) ④검사 또는 사법경찰관이 피고인이 아닌 자의 진술을 기재한 조서는 적법한 절차와 방식에 따라 작성된 것으로서 그 조서가 검사 또는 사법경찰관 앞에서 진술한 내용과 동일하게 기재되어 있음이 원진술자의 공판준비 또는 공판기일에서의 진술이나 영상녹화물 또는 그 밖의 객관적인 방법에 의하여 증명되고, 피고인 또는 변호인이 공판준비 또는 공판기일에 그 기재 내용에 관하여 원진술자를 신문할 수 있었던 때에는 증거로 할 수 있다. 다만, 그 조서에 기재된 진술이 특히 신빙할 수 있는 상태하에서 행하여졌음이 증명된 때에 한한다.
 제318조의2(증명력을 다투기 위한 증거) ①제312조부터 제316조까지의 규정에 따라 증거로 할 수 없는 서류나 진술이라도 공판준비 또는 공판기일에서의 피고인 또는 피고인이 아닌 자(공소제기 전에 피고인을 피의자로 조사하였거나 그 조사에 참여하였던 자를 포함한다. 이하 이 조에서 같다)의 진술의 증명력을 다투기 위하여 증거로 할 수 있다.
 ②제1항에도 불구하고 피고인 또는 피고인이 아닌 자의 진술을 내용으로 하는 영상녹화물은 공판준비 또는 공판기일에 피고인 또는 피고인이 아닌 자가 진술함에 있어서 기억이 명백하지 아니한 사항에 관하여 기억을 환기시켜야 할 필요가 있다고 인정되는 때에 한하여 피고인 또는 피고인이 아닌 자에게 재생하여 시청하게 할 수 있다."
